{
  "id": "kanagawa",
  "label": "Kanagawa",
  "dark": {
    "bg": "#1f1f28",
    "surface": "#1f1f28",
    "panel": "#16161d",
    "fg": "#dcd7ba",
    "fg_secondary": "#727169",
    "fg_tertiary": "#727169",
    "caption": "#727169",
    "brand": "#7e9cd8",
    "brand_soft": "#957fb8",
    "bubble_bg": "#2d4f67",
    "bubble_fg": "#c8c093",
    "border": "#727169",
    "code_bg": "#1f1f28",
    "ok": "#76946a",
    "warn": "#c0a36e",
    "err": "#c34043",
    "hint": "#6a9589",
    "chip_bg": "#16161d"
  },
  "light": {
    "bg": "#f2ecbc",
    "surface": "#f2ecbc",
    "panel": "#c9cbd1",
    "fg": "#545464",
    "fg_secondary": "#8a8980",
    "fg_tertiary": "#8a8980",
    "caption": "#8a8980",
    "brand": "#4d699b",
    "brand_soft": "#b35b79",
    "bubble_bg": "#c9cbd1",
    "bubble_fg": "#43436c",
    "border": "#8a8980",
    "code_bg": "#f2ecbc",
    "ok": "#6f894e",
    "warn": "#77713f",
    "err": "#c84053",
    "hint": "#597b75",
    "chip_bg": "#c9cbd1"
  }
}
