{
  "id": "ghostty",
  "label": "Ghostty",
  "dark": {
    "bg": "#282c34",
    "surface": "#282c34",
    "panel": "#1d1f21",
    "fg": "#ffffff",
    "fg_secondary": "#666666",
    "fg_tertiary": "#666666",
    "caption": "#666666",
    "brand": "#82a2be",
    "brand_soft": "#b294bb",
    "bubble_bg": "#ffffff",
    "bubble_fg": "#282c34",
    "border": "#666666",
    "code_bg": "#282c34",
    "ok": "#b6bd68",
    "warn": "#f0c674",
    "err": "#cc6566",
    "hint": "#8abeb7",
    "chip_bg": "#1d1f21"
  },
  "light": {
    "bg": "#ffffff",
    "surface": "#ffffff",
    "panel": "#d6d6d6",
    "fg": "#4d4d4c",
    "fg_secondary": "#bfbfbf",
    "fg_tertiary": "#bfbfbf",
    "caption": "#bfbfbf",
    "brand": "#4271ae",
    "brand_soft": "#8959a8",
    "bubble_bg": "#d6d6d6",
    "bubble_fg": "#4d4d4c",
    "border": "#bfbfbf",
    "code_bg": "#ffffff",
    "ok": "#718c00",
    "warn": "#eab700",
    "err": "#c82829",
    "hint": "#3e999f",
    "chip_bg": "#d6d6d6"
  }
}
