{
  "id": "solarized",
  "label": "Solarized",
  "dark": {
    "bg": "#002b36",
    "surface": "#002b36",
    "panel": "#073642",
    "fg": "#839496",
    "fg_secondary": "#586e75",
    "fg_tertiary": "#586e75",
    "caption": "#586e75",
    "brand": "#268bd2",
    "brand_soft": "#d33682",
    "bubble_bg": "#073642",
    "bubble_fg": "#93a1a1",
    "border": "#586e75",
    "code_bg": "#002b36",
    "ok": "#859900",
    "warn": "#b58900",
    "err": "#dc322f",
    "hint": "#2aa198",
    "chip_bg": "#073642"
  },
  "light": {
    "bg": "#fdf6e3",
    "surface": "#fdf6e3",
    "panel": "#eee8d5",
    "fg": "#657b83",
    "fg_secondary": "#586e75",
    "fg_tertiary": "#586e75",
    "caption": "#586e75",
    "brand": "#268bd2",
    "brand_soft": "#d33682",
    "bubble_bg": "#eee8d5",
    "bubble_fg": "#586e75",
    "border": "#586e75",
    "code_bg": "#fdf6e3",
    "ok": "#859900",
    "warn": "#b58900",
    "err": "#dc322f",
    "hint": "#2aa198",
    "chip_bg": "#eee8d5"
  }
}
