{
  "id": "catppuccin",
  "label": "Catppuccin",
  "dark": {
    "bg": "#1e1e2e",
    "surface": "#1e1e2e",
    "panel": "#45475a",
    "fg": "#cdd6f4",
    "fg_secondary": "#585b70",
    "fg_tertiary": "#585b70",
    "caption": "#585b70",
    "brand": "#89b4fa",
    "brand_soft": "#f5c2e7",
    "bubble_bg": "#353748",
    "bubble_fg": "#cdd6f4",
    "border": "#585b70",
    "code_bg": "#1e1e2e",
    "ok": "#a6e3a1",
    "warn": "#f9e2af",
    "err": "#f38ba8",
    "hint": "#94e2d5",
    "chip_bg": "#45475a"
  },
  "light": {
    "bg": "#eff1f5",
    "surface": "#eff1f5",
    "panel": "#bcc0cc",
    "fg": "#4c4f69",
    "fg_secondary": "#6c6f85",
    "fg_tertiary": "#6c6f85",
    "caption": "#6c6f85",
    "brand": "#1e66f5",
    "brand_soft": "#ea76cb",
    "bubble_bg": "#d8dae1",
    "bubble_fg": "#4c4f69",
    "border": "#6c6f85",
    "code_bg": "#eff1f5",
    "ok": "#40a02b",
    "warn": "#df8e1d",
    "err": "#d20f39",
    "hint": "#179299",
    "chip_bg": "#bcc0cc"
  }
}
