{
  "id": "gruvbox",
  "label": "Gruvbox",
  "dark": {
    "bg": "#282828",
    "surface": "#282828",
    "panel": "#504945",
    "fg": "#ebdbb2",
    "fg_secondary": "#928374",
    "fg_tertiary": "#928374",
    "caption": "#928374",
    "brand": "#fabd2f",
    "brand_soft": "#d3869b",
    "bubble_bg": "#504945",
    "bubble_fg": "#ebdbb2",
    "border": "#928374",
    "code_bg": "#282828",
    "ok": "#b8bb26",
    "warn": "#fe8019",
    "err": "#fb4934",
    "hint": "#83a598",
    "chip_bg": "#504945"
  },
  "light": {
    "bg": "#fbf1c7",
    "surface": "#fbf1c7",
    "panel": "#d5c4a1",
    "fg": "#3c3836",
    "fg_secondary": "#928374",
    "fg_tertiary": "#928374",
    "caption": "#928374",
    "brand": "#b57614",
    "brand_soft": "#8f3f71",
    "bubble_bg": "#d5c4a1",
    "bubble_fg": "#3c3836",
    "border": "#928374",
    "code_bg": "#fbf1c7",
    "ok": "#79740e",
    "warn": "#af3a03",
    "err": "#9d0006",
    "hint": "#427b58",
    "chip_bg": "#d5c4a1"
  }
}
