{
  "id": "ayu",
  "label": "Ayu",
  "dark": {
    "bg": "#0b0e14",
    "surface": "#0b0e14",
    "panel": "#1e232b",
    "fg": "#bfbdb6",
    "fg_secondary": "#686868",
    "fg_tertiary": "#686868",
    "caption": "#686868",
    "brand": "#53bdfa",
    "brand_soft": "#cda1fa",
    "bubble_bg": "#1b3a5b",
    "bubble_fg": "#bfbdb6",
    "border": "#686868",
    "code_bg": "#0b0e14",
    "ok": "#7fd962",
    "warn": "#f9af4f",
    "err": "#ea6c73",
    "hint": "#90e1c6",
    "chip_bg": "#1e232b"
  },
  "light": {
    "bg": "#f8f9fa",
    "surface": "#f8f9fa",
    "panel": "#d1d1d1",
    "fg": "#5c6166",
    "fg_secondary": "#686868",
    "fg_tertiary": "#686868",
    "caption": "#686868",
    "brand": "#3199e1",
    "brand_soft": "#9e75c7",
    "bubble_bg": "#d3e1f5",
    "bubble_fg": "#5c6166",
    "border": "#686868",
    "code_bg": "#f8f9fa",
    "ok": "#6cbf43",
    "warn": "#eca944",
    "err": "#ea6c6d",
    "hint": "#46ba94",
    "chip_bg": "#d1d1d1"
  }
}
