{
  "id": "one-half",
  "label": "One Half",
  "dark": {
    "bg": "#282c34",
    "surface": "#282c34",
    "panel": "#474e5d",
    "fg": "#dcdfe4",
    "fg_secondary": "#474e5d",
    "fg_tertiary": "#474e5d",
    "caption": "#474e5d",
    "brand": "#61afef",
    "brand_soft": "#c678dd",
    "bubble_bg": "#474e5d",
    "bubble_fg": "#dcdfe4",
    "border": "#474e5d",
    "code_bg": "#282c34",
    "ok": "#98c379",
    "warn": "#e5c07b",
    "err": "#e06c75",
    "hint": "#56b6c2",
    "chip_bg": "#474e5d"
  },
  "light": {
    "bg": "#fafafa",
    "surface": "#fafafa",
    "panel": "#ffffff",
    "fg": "#383a42",
    "fg_secondary": "#4f525e",
    "fg_tertiary": "#4f525e",
    "caption": "#4f525e",
    "brand": "#0184bc",
    "brand_soft": "#a626a4",
    "bubble_bg": "#bfceff",
    "bubble_fg": "#383a42",
    "border": "#4f525e",
    "code_bg": "#fafafa",
    "ok": "#50a14f",
    "warn": "#c18401",
    "err": "#e45649",
    "hint": "#0997b3",
    "chip_bg": "#ffffff"
  }
}
