{
  "id": "seoul256",
  "label": "Seoul256",
  "dark": {
    "bg": "#3a3a3a",
    "surface": "#3a3a3a",
    "panel": "#4e4e4e",
    "fg": "#d0d0d0",
    "fg_secondary": "#626262",
    "fg_tertiary": "#626262",
    "caption": "#626262",
    "brand": "#85add4",
    "brand_soft": "#d7afaf",
    "bubble_bg": "#005f5f",
    "bubble_fg": "#d0d0d0",
    "border": "#626262",
    "code_bg": "#3a3a3a",
    "ok": "#5f865f",
    "warn": "#d8af5f",
    "err": "#d68787",
    "hint": "#87afaf",
    "chip_bg": "#4e4e4e"
  },
  "light": {
    "bg": "#dadada",
    "surface": "#dadada",
    "panel": "#eeeeee",
    "fg": "#4e4e4e",
    "fg_secondary": "#e4e4e4",
    "fg_tertiary": "#e4e4e4",
    "caption": "#e4e4e4",
    "brand": "#5f87ae",
    "brand_soft": "#875f87",
    "bubble_bg": "#afd7d7",
    "bubble_fg": "#4e4e4e",
    "border": "#e4e4e4",
    "code_bg": "#dadada",
    "ok": "#5f885f",
    "warn": "#af8760",
    "err": "#af5f5f",
    "hint": "#5f8787",
    "chip_bg": "#eeeeee"
  }
}
