{
  "id": "iceberg",
  "label": "Iceberg",
  "dark": {
    "bg": "#161821",
    "surface": "#161821",
    "panel": "#1e2132",
    "fg": "#c6c8d1",
    "fg_secondary": "#6b7089",
    "fg_tertiary": "#6b7089",
    "caption": "#6b7089",
    "brand": "#84a0c6",
    "brand_soft": "#a093c7",
    "bubble_bg": "#272c42",
    "bubble_fg": "#c6c8d1",
    "border": "#6b7089",
    "code_bg": "#161821",
    "ok": "#b4be82",
    "warn": "#e2a478",
    "err": "#e27878",
    "hint": "#89b8c2",
    "chip_bg": "#1e2132"
  },
  "light": {
    "bg": "#e8e9ec",
    "surface": "#e8e9ec",
    "panel": "#dcdfe7",
    "fg": "#33374c",
    "fg_secondary": "#8389a3",
    "fg_tertiary": "#8389a3",
    "caption": "#8389a3",
    "brand": "#2d539e",
    "brand_soft": "#7759b4",
    "bubble_bg": "#cacdd7",
    "bubble_fg": "#33374c",
    "border": "#8389a3",
    "code_bg": "#e8e9ec",
    "ok": "#668e3d",
    "warn": "#c57339",
    "err": "#cc517a",
    "hint": "#3f83a6",
    "chip_bg": "#dcdfe7"
  }
}
