{
  "id": "one",
  "label": "One",
  "dark": {
    "bg": "#282c34",
    "surface": "#282c34",
    "panel": "#1e2127",
    "fg": "#abb2bf",
    "fg_secondary": "#5c6370",
    "fg_tertiary": "#5c6370",
    "caption": "#5c6370",
    "brand": "#61afef",
    "brand_soft": "#c678dd",
    "bubble_bg": "#abb2bf",
    "bubble_fg": "#282c34",
    "border": "#5c6370",
    "code_bg": "#282c34",
    "ok": "#98c379",
    "warn": "#d19a66",
    "err": "#e06c75",
    "hint": "#56b6c2",
    "chip_bg": "#1e2127"
  },
  "light": {
    "bg": "#f8f8f8",
    "surface": "#f8f8f8",
    "panel": "#bbbbbb",
    "fg": "#2a2b33",
    "fg_secondary": "#5c6370",
    "fg_tertiary": "#5c6370",
    "caption": "#5c6370",
    "brand": "#2f5af3",
    "brand_soft": "#a00095",
    "bubble_bg": "#2a2b33",
    "bubble_fg": "#f8f8f8",
    "border": "#5c6370",
    "code_bg": "#f8f8f8",
    "ok": "#3e953a",
    "warn": "#c18401",
    "err": "#de3d35",
    "hint": "#0184bc",
    "chip_bg": "#bbbbbb"
  }
}
