{
  "id": "everforest",
  "label": "Everforest",
  "dark": {
    "bg": "#2d353b",
    "surface": "#2d353b",
    "panel": "#343f44",
    "fg": "#d3c6aa",
    "fg_secondary": "#859289",
    "fg_tertiary": "#859289",
    "caption": "#859289",
    "brand": "#7fbbb3",
    "brand_soft": "#d699b6",
    "bubble_bg": "#414b51",
    "bubble_fg": "#d3c6aa",
    "border": "#859289",
    "code_bg": "#2d353b",
    "ok": "#a7c080",
    "warn": "#dbbc7f",
    "err": "#e67e80",
    "hint": "#83c092",
    "chip_bg": "#343f44"
  },
  "light": {
    "bg": "#fdf6e3",
    "surface": "#fdf6e3",
    "panel": "#f4f0d9",
    "fg": "#5c6a72",
    "fg_secondary": "#939f91",
    "fg_tertiary": "#939f91",
    "caption": "#939f91",
    "brand": "#3a94c5",
    "brand_soft": "#df69ba",
    "bubble_bg": "#efe9d5",
    "bubble_fg": "#5c6a72",
    "border": "#939f91",
    "code_bg": "#fdf6e3",
    "ok": "#8da101",
    "warn": "#dfa000",
    "err": "#f85552",
    "hint": "#35a77c",
    "chip_bg": "#f4f0d9"
  }
}
