{
  "id": "one-dark-pro",
  "label": "One Dark Pro",
  "dark": {
    "bg": "#1e2127",
    "surface": "#1e2127",
    "panel": "#3a3f4b",
    "fg": "#abb2bf",
    "fg_secondary": "#5c6370",
    "fg_tertiary": "#5c6370",
    "caption": "#5c6370",
    "brand": "#61afef",
    "brand_soft": "#c678dd",
    "bubble_bg": "#3a3f4b",
    "bubble_fg": "#abb2bf",
    "border": "#5c6370",
    "code_bg": "#1e2127",
    "ok": "#98c379",
    "warn": "#d19a66",
    "err": "#e06c75",
    "hint": "#56b6c2",
    "chip_bg": "#3a3f4b"
  },
  "light": {
    "bg": "#f9f9f9",
    "surface": "#f9f9f9",
    "panel": "#ffffff",
    "fg": "#383a42",
    "fg_secondary": "#a0a1a7",
    "fg_tertiary": "#a0a1a7",
    "caption": "#a0a1a7",
    "brand": "#4078f2",
    "brand_soft": "#a626a4",
    "bubble_bg": "#a0a1a7",
    "bubble_fg": "#383a42",
    "border": "#a0a1a7",
    "code_bg": "#f9f9f9",
    "ok": "#50a14f",
    "warn": "#986801",
    "err": "#e45649",
    "hint": "#0184bc",
    "chip_bg": "#3a3f4b"
  }
}
