{
  "id": "catppuccin",
  "label": "Catppuccin",
  "dark": {
    "bg": "#1e1e2e",
    "surface": "#1e1e2e",
    "panel": "#45475a",
    "fg": "#cdd6f4",
    "fg_secondary": "#585b70",
    "fg_tertiary": "#585b70",
    "caption": "#585b70",
    "brand": "#89b4fa",
    "brand_soft": "#f5c2e7",
    "bubble_bg": "#353748",
    "bubble_fg": "#cdd6f4",
    "border": "#585b70",
    "code_bg": "#1e1e2e",
    "ok": "#a6e3a1",
    "warn": "#f9e2af",
    "err": "#f38ba8",
    "hint": "#94e2d5",
    "chip_bg": "#45475a"
  },
  "light": {
    "bg": "#303446",
    "surface": "#303446",
    "panel": "#51576d",
    "fg": "#c6d0f5",
    "fg_secondary": "#626880",
    "fg_tertiary": "#626880",
    "caption": "#626880",
    "brand": "#8caaee",
    "brand_soft": "#f4b8e4",
    "bubble_bg": "#44495d",
    "bubble_fg": "#c6d0f5",
    "border": "#626880",
    "code_bg": "#303446",
    "ok": "#a6d189",
    "warn": "#e5c890",
    "err": "#e78284",
    "hint": "#81c8be",
    "chip_bg": "#51576d"
  }
}
