{
  "id": "ember",
  "label": "Ember",
  "dark": {
    "bg": "#16100E",
    "surface": "#201612",
    "panel": "#2A1C16",
    "fg": "#FFF4E6",
    "fg_secondary": "#D2B4A0",
    "fg_tertiary": "#A0826E",
    "caption": "#78645A",
    "brand": "#F78C3C",
    "brand_soft": "#FFAA5A",
    "bubble_bg": "#30201A",
    "bubble_fg": "#FFF4E6",
    "border": "#463028",
    "code_bg": "#1C1210",
    "ok": "#78BE6E",
    "warn": "#F7AD31",
    "err": "#F25A5A",
    "hint": "#C48C64",
    "chip_bg": "#463028"
  },
  "light": {
    "bg": "#FFF6EE",
    "surface": "#FFE8D6",
    "panel": "#FFDCC4",
    "fg": "#2A1810",
    "fg_secondary": "#5A3C2E",
    "fg_tertiary": "#7A5848",
    "caption": "#9A7868",
    "brand": "#D96A1E",
    "brand_soft": "#E88838",
    "bubble_bg": "#FFE0C8",
    "bubble_fg": "#2A1810",
    "border": "#E8C4A8",
    "code_bg": "#FFE8D6",
    "ok": "#2F8F44",
    "warn": "#DD8629",
    "err": "#EC1313",
    "hint": "#A06038",
    "chip_bg": "#FFD4B0"
  }
}
