{
  "id": "default",
  "label": "Default",
  "dark": {
    "bg": "#0F1115",
    "surface": "#151517",
    "panel": "#1B1B1C",
    "fg": "#F9FAFB",
    "fg_secondary": "#CFD3D6",
    "fg_tertiary": "#979DA6",
    "caption": "#81858C",
    "brand": "#5686FE",
    "brand_soft": "#679EFE",
    "bubble_bg": "#1B1B1C",
    "bubble_fg": "#F1F3F5",
    "border": "#2C2C2E",
    "code_bg": "#151517",
    "ok": "#4ED17E",
    "warn": "#F7AD31",
    "err": "#F25A5A",
    "hint": "#6C7A96",
    "chip_bg": "#2C2C2E"
  },
  "light": {
    "bg": "#FFFFFF",
    "surface": "#F9FAFB",
    "panel": "#F5F6F7",
    "fg": "#0F1115",
    "fg_secondary": "#43454A",
    "fg_tertiary": "#61666B",
    "caption": "#ADB2B8",
    "brand": "#4176E6",
    "brand_soft": "#5686FE",
    "bubble_bg": "#F1F3F5",
    "bubble_fg": "#0F1115",
    "border": "#E1E5EE",
    "code_bg": "#F5F6F7",
    "ok": "#22C55E",
    "warn": "#DD8629",
    "err": "#EC1313",
    "hint": "#546078",
    "chip_bg": "#EBEEF2"
  }
}
