{
  "id": "tomorrow",
  "label": "Tomorrow",
  "dark": {
    "bg": "#000000",
    "surface": "#000000",
    "panel": "#424242",
    "fg": "#eaeaea",
    "fg_secondary": "#969896",
    "fg_tertiary": "#969896",
    "caption": "#969896",
    "brand": "#7aa6da",
    "brand_soft": "#c397d8",
    "bubble_bg": "#424242",
    "bubble_fg": "#eaeaea",
    "border": "#969896",
    "code_bg": "#000000",
    "ok": "#b9ca4a",
    "warn": "#e7c547",
    "err": "#d54e53",
    "hint": "#70c0b1",
    "chip_bg": "#424242"
  },
  "light": {
    "bg": "#ffffff",
    "surface": "#ffffff",
    "panel": "#d6d6d6",
    "fg": "#4d4d4c",
    "fg_secondary": "#8e908c",
    "fg_tertiary": "#8e908c",
    "caption": "#8e908c",
    "brand": "#4271ae",
    "brand_soft": "#8959a8",
    "bubble_bg": "#d6d6d6",
    "bubble_fg": "#4d4d4c",
    "border": "#8e908c",
    "code_bg": "#ffffff",
    "ok": "#718c00",
    "warn": "#eab700",
    "err": "#c82829",
    "hint": "#3e999f",
    "chip_bg": "#d6d6d6"
  }
}
