{
  "id": "nord",
  "label": "Nord",
  "dark": {
    "bg": "#2e3440",
    "surface": "#2e3440",
    "panel": "#3b4252",
    "fg": "#d8dee9",
    "fg_secondary": "#596377",
    "fg_tertiary": "#596377",
    "caption": "#596377",
    "brand": "#81a1c1",
    "brand_soft": "#b48ead",
    "bubble_bg": "#eceff4",
    "bubble_fg": "#4c566a",
    "border": "#596377",
    "code_bg": "#2e3440",
    "ok": "#a3be8c",
    "warn": "#ebcb8b",
    "err": "#bf616a",
    "hint": "#88c0d0",
    "chip_bg": "#3b4252"
  },
  "light": {
    "bg": "#e5e9f0",
    "surface": "#e5e9f0",
    "panel": "#eceff4",
    "fg": "#414858",
    "fg_secondary": "#4c566a",
    "fg_tertiary": "#4c566a",
    "caption": "#4c566a",
    "brand": "#81a1c1",
    "brand_soft": "#b48ead",
    "bubble_bg": "#d8dee9",
    "bubble_fg": "#4c556a",
    "border": "#4c566a",
    "code_bg": "#e5e9f0",
    "ok": "#96b17f",
    "warn": "#c5a565",
    "err": "#bf616a",
    "hint": "#7bb3c3",
    "chip_bg": "#eceff4"
  }
}
