{
  "id": "github",
  "label": "GitHub",
  "dark": {
    "bg": "#010409",
    "surface": "#010409",
    "panel": "#484f58",
    "fg": "#e6edf3",
    "fg_secondary": "#6e7681",
    "fg_tertiary": "#6e7681",
    "caption": "#6e7681",
    "brand": "#58a6ff",
    "brand_soft": "#bc8cff",
    "bubble_bg": "#264f78",
    "bubble_fg": "#e6edf3",
    "border": "#6e7681",
    "code_bg": "#010409",
    "ok": "#3fb950",
    "warn": "#d29922",
    "err": "#ff7b72",
    "hint": "#39c5cf",
    "chip_bg": "#484f58"
  },
  "light": {
    "bg": "#1c2128",
    "surface": "#1c2128",
    "panel": "#545d68",
    "fg": "#adbac7",
    "fg_secondary": "#636e7b",
    "fg_tertiary": "#636e7b",
    "caption": "#636e7b",
    "brand": "#539bf5",
    "brand_soft": "#b083f0",
    "bubble_bg": "#264f78",
    "bubble_fg": "#adbac7",
    "border": "#636e7b",
    "code_bg": "#1c2128",
    "ok": "#57ab5a",
    "warn": "#c69026",
    "err": "#f47067",
    "hint": "#39c5cf",
    "chip_bg": "#545d68"
  }
}
