{
  "id": "night-owl",
  "label": "Night Owl",
  "dark": {
    "bg": "#011627",
    "surface": "#011627",
    "panel": "#093b5e",
    "fg": "#cccccc",
    "fg_secondary": "#575656",
    "fg_tertiary": "#575656",
    "caption": "#575656",
    "brand": "#82aaff",
    "brand_soft": "#c792ea",
    "bubble_bg": "#093b5e",
    "bubble_fg": "#cccccc",
    "border": "#575656",
    "code_bg": "#011627",
    "ok": "#22da6e",
    "warn": "#c5e478",
    "err": "#ef5350",
    "hint": "#21c7a8",
    "chip_bg": "#093b5e"
  },
  "light": {
    "bg": "#f6f6f6",
    "surface": "#f6f6f6",
    "panel": "#93a1a1",
    "fg": "#403f53",
    "fg_secondary": "#93a1a1",
    "fg_tertiary": "#93a1a1",
    "caption": "#93a1a1",
    "brand": "#288ed7",
    "brand_soft": "#d6438a",
    "bubble_bg": "#e0e0e0",
    "bubble_fg": "#403f53",
    "border": "#93a1a1",
    "code_bg": "#f6f6f6",
    "ok": "#08916a",
    "warn": "#e0af02",
    "err": "#de3d3b",
    "hint": "#2aa298",
    "chip_bg": "#403f53"
  }
}
