{
  "id": "nvim",
  "label": "Nvim",
  "dark": {
    "bg": "#14161b",
    "surface": "#14161b",
    "panel": "#07080d",
    "fg": "#e0e2ea",
    "fg_secondary": "#4f5258",
    "fg_tertiary": "#4f5258",
    "caption": "#4f5258",
    "brand": "#a6dbff",
    "brand_soft": "#ffcaff",
    "bubble_bg": "#4f5258",
    "bubble_fg": "#e0e2ea",
    "border": "#4f5258",
    "code_bg": "#14161b",
    "ok": "#b3f6c0",
    "warn": "#fce094",
    "err": "#ffc0b9",
    "hint": "#8cf8f7",
    "chip_bg": "#07080d"
  },
  "light": {
    "bg": "#e0e2ea",
    "surface": "#e0e2ea",
    "panel": "#eef1f8",
    "fg": "#14161b",
    "fg_secondary": "#4f5258",
    "fg_tertiary": "#4f5258",
    "caption": "#4f5258",
    "brand": "#004c73",
    "brand_soft": "#470045",
    "bubble_bg": "#9b9ea4",
    "bubble_fg": "#14161b",
    "border": "#4f5258",
    "code_bg": "#e0e2ea",
    "ok": "#005523",
    "warn": "#6b5300",
    "err": "#590008",
    "hint": "#007373",
    "chip_bg": "#eef1f8"
  }
}
